{
  "schema": "szk.ma.grade/v1",
  "outcome_id": "o2",
  "importance": null,
  "run_id": null,
  "start": null,
  "start_reason": null,
  "domains": {
    "risk_of_bias": {
      "rating": null,
      "step": null,
      "rationale": null,
      "advisory": null,
      "suggestion": {
        "rating": null,
        "step": null,
        "status": "human_judgement",
        "summary": {
          "hu": "— (emberi ítélet)",
          "en": "— (human judgement)"
        },
        "why": {
          "asks": {
            "hu": "Mit kérdez a domén? …",
            "en": "What does the domain ask? …"
          },
          "because": {
            "hu": "Miért ez a javaslat? …",
            "en": "Why this suggestion? …"
          },
          "change": {
            "hu": "Mi változtatná meg? …",
            "en": "What would change it? …"
          },
          "uncertain": null
        },
        "flags": [],
        "kb_refs": [
          "GRADE-05"
        ],
        "concern": false,
        "evidence": []
      }
    },
    "inconsistency": {
      "rating": null,
      "step": null,
      "rationale": null,
      "advisory": null,
      "suggestion": {
        "rating": null,
        "step": null,
        "status": "human_judgement",
        "summary": {
          "hu": "— (emberi ítélet)",
          "en": "— (human judgement)"
        },
        "why": {
          "asks": {
            "hu": "Mit kérdez a domén? …",
            "en": "What does the domain ask? …"
          },
          "because": {
            "hu": "Miért ez a javaslat? …",
            "en": "Why this suggestion? …"
          },
          "change": {
            "hu": "Mi változtatná meg? …",
            "en": "What would change it? …"
          },
          "uncertain": null
        },
        "flags": [],
        "kb_refs": [
          "GRADE-05"
        ],
        "concern": false,
        "evidence": []
      }
    },
    "indirectness": {
      "rating": null,
      "step": null,
      "rationale": null,
      "advisory": null,
      "suggestion": {
        "rating": null,
        "step": null,
        "status": "human_judgement",
        "summary": {
          "hu": "— (emberi ítélet)",
          "en": "— (human judgement)"
        },
        "why": {
          "asks": {
            "hu": "Mit kérdez a domén? …",
            "en": "What does the domain ask? …"
          },
          "because": {
            "hu": "Miért ez a javaslat? …",
            "en": "Why this suggestion? …"
          },
          "change": {
            "hu": "Mi változtatná meg? …",
            "en": "What would change it? …"
          },
          "uncertain": null
        },
        "flags": [],
        "kb_refs": [
          "GRADE-05"
        ],
        "concern": false,
        "evidence": []
      }
    },
    "imprecision": {
      "rating": null,
      "step": null,
      "rationale": null,
      "advisory": null,
      "suggestion": {
        "rating": "serious",
        "step": -1,
        "status": "suggested",
        "summary": {
          "hu": "CI [-36.32; 6.11] átlépi: MID ±10",
          "en": "CI −36.32 to 6.11 crosses MID ±10"
        },
        "why": {
          "asks": {
            "hu": "Mit kérdez a domén? …",
            "en": "What does the domain ask? …"
          },
          "because": {
            "hu": "Miért ez a javaslat? …",
            "en": "Why this suggestion? …"
          },
          "change": {
            "hu": "Mi változtatná meg? …",
            "en": "What would change it? …"
          },
          "uncertain": {
            "hu": "k = 4: a heterogenitás becslése bizonytalan.",
            "en": "k = 4: the heterogeneity estimate is uncertain."
          }
        },
        "flags": [
          {
            "code": "few_studies",
            "level": "warning",
            "domain": null,
            "text": {
              "hu": "k = 4",
              "en": "k = 4"
            }
          }
        ],
        "kb_refs": [
          "GRADE-06",
          "D-S13-006"
        ],
        "concern": true,
        "evidence": [
          {
            "label": {
              "hu": "95% CI",
              "en": "95% CI"
            },
            "text": {
              "hu": "[-36.32; 6.11]",
              "en": "−36.32 to 6.11"
            }
          }
        ]
      }
    },
    "publication_bias": {
      "rating": null,
      "step": null,
      "rationale": null,
      "advisory": null,
      "suggestion": {
        "rating": null,
        "step": null,
        "status": "human_judgement",
        "summary": {
          "hu": "— (emberi ítélet)",
          "en": "— (human judgement)"
        },
        "why": {
          "asks": {
            "hu": "Mit kérdez a domén? …",
            "en": "What does the domain ask? …"
          },
          "because": {
            "hu": "Miért ez a javaslat? …",
            "en": "Why this suggestion? …"
          },
          "change": {
            "hu": "Mi változtatná meg? …",
            "en": "What would change it? …"
          },
          "uncertain": null
        },
        "flags": [],
        "kb_refs": [
          "GRADE-05"
        ],
        "concern": false,
        "evidence": []
      },
      "status": "open"
    }
  },
  "upgrades": {
    "large_effect": false,
    "dose_response": false,
    "opposing_confounding": false
  },
  "certainty": null,
  "consistency_warning": null,
  "validator_rollup": null,
  "status": "draft",
  "mid": null
}
